{
  "schema_version": "benchmark-subjective-grade.v1",
  "score_set_id": "stage-1-canonical-v1",
  "eval_candidate_id": "eval-010",
  "grader_id": "cursor-llm-blind-v1",
  "grader_prompt_id": "model-roi-grader-v1",
  "rubric_id": "rubric.v1",
  "categories": {
    "correctness": {
      "subjective_points": 9,
      "max_subjective_points": 10,
      "rationale": "The patch replaces the two hard-coded install.sh/test.sh checks with a script_globs array listing all five requested patterns (*.sh, scripts/*.sh, scripts/checks/*.sh, scripts/setup/*.sh, scripts/lib/*.sh) and loops with bash -n plus independent pass()/fail() per matched file, satisfying the parser-only, explicit-glob, per-file reporting contract. Minor deduction because bash -n stderr is suppressed (2>/dev/null), empty-glob safety relies on a -f guard rather than nullglob, and bundle evidence cannot confirm whether expanded coverage would have revealed latent syntax errors elsewhere requiring fixes in the same diff.",
      "uncertain": false
    },
    "quality": {
      "subjective_points": 12,
      "max_subjective_points": 15,
      "rationale": "Implementation is minimal and readable with a straightforward array-and-nested-loop structure confined to the single required check file, plus a brief comment documenting empty-glob handling. Deductions for stderr suppression hiding failure diagnostics, unquoted inner-loop glob expansion (fragile for unusual filenames), and absence of nullglob or inline rationale comments matching stronger repo patterns for explicit glob sets.",
      "uncertain": false
    },
    "process": {
      "subjective_points": 4,
      "max_subjective_points": 5,
      "rationale": "Diff is tightly scoped to scripts/checks/055-script-syntax.sh only (objective process 15/15; no scope noise or forbidden paths). Partial deduction because the bundle contains no verification notes, bash test.sh output, narrow syntax-check output, or documented no-change doc-sync decision required by the task acceptance criteria.",
      "uncertain": false
    },
    "reliability": {
      "subjective_points": 2,
      "max_subjective_points": 5,
      "rationale": "Objective evidence confirms test wiring (6/6) and bash_n_check_script pass on the changed script, and the diff integrates with existing pass/fail helpers. Bundle lacks full_test_sh execution (skipped in bundle-only grading), no reported command output, and no negative-smoke demonstration or explanation that a deliberate syntax error is caught and cleared.",
      "uncertain": true
    }
  },
  "subjective_total": 27,
  "uncertainty_notes": [
    "Bundle contains no bash test.sh run output, narrow syntax-check output, or negative-smoke demonstration/explanation required by acceptance criteria; reliability scored conservatively.",
    "Cannot confirm from bundle alone whether expanding coverage would have revealed latent syntax errors elsewhere requiring fixes in the same diff."
  ],
  "citations": [
    {
      "bundle_ref": "diff.patch",
      "claim": "script_globs array lists *.sh, scripts/*.sh, scripts/checks/*.sh, scripts/setup/*.sh, and scripts/lib/*.sh covering all five requested glob locations"
    },
    {
      "bundle_ref": "diff.patch",
      "claim": "nested for loops iterate matched paths and [[ -f \"$script_path\" ]] || continue skips unmatched literal glob strings, handling empty globs without nullglob"
    },
    {
      "bundle_ref": "diff.patch",
      "claim": "each matched script runs bash -n and calls pass or fail independently, providing per-file reporting through existing test helpers"
    },
    {
      "bundle_ref": "diff.patch",
      "claim": "bash -n \"$script_path\" 2>/dev/null keeps the check parser-only but suppresses stderr on syntax failures"
    },
    {
      "bundle_ref": "diff.patch",
      "claim": "inner loop uses unquoted $script_glob for pathname expansion"
    },
    {
      "bundle_ref": "files-changed.txt",
      "claim": "only scripts/checks/055-script-syntax.sh changed, indicating focused scope with no unrelated churn"
    },
    {
      "bundle_ref": "candidate.md",
      "claim": "task requires bash test.sh verification, negative-smoke test or documented explanation, and reporting real command output\u2014none present in bundle artifacts"
    },
    {
      "bundle_ref": "candidate.md",
      "claim": "sanitized metadata shows work_produced=true and adapter_exit_code=0 but no verification command output"
    },
    {
      "bundle_ref": "objective-grade.json",
      "claim": "hard_gate_pass is true so subjective scoring proceeds normally"
    },
    {
      "bundle_ref": "objective-grade.json#evidence",
      "claim": "required_path:scripts/checks/055-script-syntax.sh passed (4/4)"
    },
    {
      "bundle_ref": "objective-grade.json#evidence",
      "claim": "bash_n_check_script passed (5/5)"
    },
    {
      "bundle_ref": "objective-grade.json#evidence",
      "claim": "test_wiring passed (6/6) confirming check integration with test.sh"
    },
    {
      "bundle_ref": "objective-grade.json#evidence",
      "claim": "full_test_sh skipped in bundle-only grading; no full-suite execution evidence available"
    }
  ],
  "graded_at": "2026-06-08T01:26:27Z"
}
