{
  "schema_version": "benchmark-subjective-grade.v1",
  "score_set_id": "stage-1-canonical-v1",
  "eval_candidate_id": "eval-020",
  "grader_id": "results-md-legacy-v1",
  "grader_prompt_id": "model-roi-grader-v1",
  "rubric_id": "rubric.v1",
  "categories": {
    "correctness": {
      "subjective_points": 10,
      "max_subjective_points": 10,
      "rationale": "Strong Cursor Auto result with focused tests, broad helper coverage, and excellent latency."
    },
    "quality": {
      "subjective_points": 13,
      "max_subjective_points": 15,
      "rationale": "Strong Cursor Auto result with focused tests, broad helper coverage, and excellent latency."
    },
    "process": {
      "subjective_points": 3,
      "max_subjective_points": 5,
      "rationale": "Strong Cursor Auto result with focused tests, broad helper coverage, and excellent latency."
    },
    "reliability": {
      "subjective_points": 5,
      "max_subjective_points": 5,
      "rationale": "Strong Cursor Auto result with focused tests, broad helper coverage, and excellent latency."
    }
  },
  "subjective_total": 31,
  "citations": [
    {
      "bundle_ref": "diff.patch",
      "claim": "Strong Cursor Auto result with focused tests, broad helper coverage, and excellent latency."
    },
    {
      "bundle_ref": "objective-grade.json#evidence",
      "claim": "Objective automation applied before legacy subjective residual mapping."
    }
  ],
  "graded_at": "2026-06-06T23:53:23Z"
}
