{
  "schema_version": "benchmark-subjective-grade.v1",
  "score_set_id": "stage-1-canonical-v1",
  "eval_candidate_id": "eval-022",
  "grader_id": "cursor-llm-blind-v1",
  "grader_prompt_id": "model-roi-grader-v1",
  "rubric_id": "rubric.v1",
  "categories": {
    "correctness": {
      "subjective_points": 10,
      "max_subjective_points": 10,
      "rationale": "The diff replaces the two hard-coded install.sh/test.sh checks with explicit collection over all five requested glob patterns (*.sh, scripts/*.sh, scripts/checks/*.sh, scripts/setup/*.sh, scripts/lib/*.sh), enables nullglob during expansion, and runs bash -n per collected file with independent pass()/fail() reporting. Behavior matches the parser-only, per-file reporting contract inspectable from the diff.",
      "uncertain": false
    },
    "quality": {
      "subjective_points": 12,
      "max_subjective_points": 15,
      "rationale": "Implementation is minimal, readable, and scoped to the single required check file with an explicit glob array and inline comments documenting nullglob rationale and the intentional unquoted glob expansion. Deductions for redirecting bash -n stderr to /dev/null (hides syntax-error detail on failure), absence of a [[ -f \"$script\" ]] guard before bash -n, and no warn/fail path when the collected scripts array is empty after expansion.",
      "uncertain": false
    },
    "process": {
      "subjective_points": 3,
      "max_subjective_points": 5,
      "rationale": "Diff is tightly focused on scripts/checks/055-script-syntax.sh with no unrelated churn (objective scope penalties fully satisfied at 15/15). Bundle contains no verification notes, bash test.sh output, narrow syntax-check output, or documented negative-smoke demonstration/explanation required by acceptance criteria, so full plan/verification discipline cannot be confirmed from bundle evidence alone.",
      "uncertain": false
    },
    "reliability": {
      "subjective_points": 2,
      "max_subjective_points": 5,
      "rationale": "Objective evidence confirms test wiring (6/6) and bash_n_check_script pass, and the diff integrates with existing pass/fail helpers sourced by test.sh. Bundle lacks full_test_sh execution evidence (skipped in bundle-only grading), no reported command output, and no negative-smoke test or explanation that a deliberate syntax error is caught and cleared, leaving verification discipline thin despite plausible wiring.",
      "uncertain": true
    }
  },
  "subjective_total": 27,
  "uncertainty_notes": [
    "Bundle contains no bash test.sh run output, narrow syntax-check output, or negative-smoke demonstration/explanation required by acceptance criteria; reliability scored conservatively.",
    "Cannot confirm from bundle alone whether expanding coverage would have revealed latent syntax errors elsewhere requiring fixes in the same diff."
  ],
  "citations": [
    {
      "bundle_ref": "diff.patch",
      "claim": "script_globs array lists *.sh, scripts/*.sh, scripts/checks/*.sh, scripts/setup/*.sh, and scripts/lib/*.sh covering all five requested glob locations"
    },
    {
      "bundle_ref": "diff.patch",
      "claim": "shopt -s nullglob before pattern expansion and shopt -u nullglob afterward handle empty globs safely during collection"
    },
    {
      "bundle_ref": "diff.patch",
      "claim": "collect-then-check loop runs bash -n on each script and calls pass or fail independently for per-file reporting"
    },
    {
      "bundle_ref": "diff.patch",
      "claim": "bash -n \"$script\" 2>/dev/null keeps the check parser-only but suppresses stderr on syntax failures"
    },
    {
      "bundle_ref": "diff.patch",
      "claim": "no [[ -f \"$script\" ]] guard or warn path when scripts_to_check is empty after glob expansion"
    },
    {
      "bundle_ref": "diff.patch",
      "claim": "inline comments document nullglob usage and intentional unquoted glob expansion with shellcheck disable SC2206"
    },
    {
      "bundle_ref": "files-changed.txt",
      "claim": "only scripts/checks/055-script-syntax.sh changed, indicating focused scope"
    },
    {
      "bundle_ref": "candidate.md",
      "claim": "task requires bash test.sh verification, negative-smoke test or documented explanation, and reporting real command output\u2014none present in bundle artifacts"
    },
    {
      "bundle_ref": "objective-grade.json",
      "claim": "hard_gate_pass is true so subjective scoring proceeds normally"
    },
    {
      "bundle_ref": "objective-grade.json#evidence",
      "claim": "required_path:scripts/checks/055-script-syntax.sh passed (4/4)"
    },
    {
      "bundle_ref": "objective-grade.json#evidence",
      "claim": "bash_n_check_script passed (5/5)"
    },
    {
      "bundle_ref": "objective-grade.json#evidence",
      "claim": "test_wiring passed (6/6) confirming check integration with test.sh"
    },
    {
      "bundle_ref": "objective-grade.json#evidence",
      "claim": "full_test_sh skipped in bundle-only grading; no full-suite execution evidence available"
    }
  ],
  "graded_at": "2026-06-08T01:34:49Z"
}
