{
  "schema_version": "benchmark-subjective-grade.v1",
  "score_set_id": "stage-1-canonical-v1",
  "eval_candidate_id": "eval-009",
  "grader_id": "cursor-llm-blind-v1",
  "grader_prompt_id": "model-roi-grader-v1",
  "rubric_id": "rubric.v1",
  "categories": {
    "correctness": {
      "subjective_points": 9,
      "max_subjective_points": 10,
      "rationale": "The patch replaces the two hard-coded install.sh/test.sh checks with an array over all five requested glob patterns (*.sh, scripts/*.sh, scripts/checks/*.sh, scripts/setup/*.sh, scripts/lib/*.sh), enables nullglob before expansion, and loops with bash -n plus independent pass()/fail() per file\u2014matching the parser-only, explicit-glob, per-file reporting contract. Minor deduction because bash -n stderr is suppressed on the failure path (2>/dev/null), so syntax-error diagnostics are not surfaced when fail() fires, and bundle evidence cannot confirm whether expanded coverage revealed latent syntax errors elsewhere requiring fixes in the same diff.",
      "uncertain": false
    },
    "quality": {
      "subjective_points": 12,
      "max_subjective_points": 15,
      "rationale": "Implementation is minimal and readable with a straightforward array-and-loop structure, and AI_REPO_GUIDE.md is appropriately synced to document the widened coverage. Deductions for stderr suppression hiding failure diagnostics, no inline comments documenting the explicit glob set or nullglob rationale, unquoted inner-loop glob expansion (fragile for unusual filenames), and diff churn in three .context/state session files unrelated to maintainable production code.",
      "uncertain": false
    },
    "process": {
      "subjective_points": 2,
      "max_subjective_points": 5,
      "rationale": "AI_REPO_GUIDE doc-sync and a referenced plan in session state show partial process discipline, but the diff includes three forbidden .context/state files (objective forbidden-path and scope penalties), task record still marks verification, negative smoke, and commit as incomplete, and the PR is not scoped to the check plus required doc-sync alone.",
      "uncertain": false
    },
    "reliability": {
      "subjective_points": 2,
      "max_subjective_points": 5,
      "rationale": "Objective evidence confirms test wiring (6/6) and bash_n_check_script pass on the changed script, and the diff integrates with existing pass/fail helpers. Bundle lacks full_test_sh execution (skipped in bundle-only grading), no reported bash test.sh or narrow syntax-check output, task record explicitly leaves negative-smoke verification unchecked, and no demonstration that a deliberate syntax error is caught and cleared.",
      "uncertain": true
    }
  },
  "subjective_total": 25,
  "uncertainty_notes": [
    "Bundle contains no bash test.sh run output, narrow syntax-check output, or negative-smoke demonstration/explanation required by acceptance criteria; reliability scored conservatively.",
    "Cannot confirm from bundle alone whether expanding coverage would have revealed latent syntax errors elsewhere requiring fixes in the same diff."
  ],
  "citations": [
    {
      "bundle_ref": "diff.patch",
      "claim": "_syntax_globs array lists *.sh, scripts/*.sh, scripts/checks/*.sh, scripts/setup/*.sh, and scripts/lib/*.sh covering all five requested glob locations"
    },
    {
      "bundle_ref": "diff.patch",
      "claim": "shopt -s nullglob wraps the glob loops so unmatched patterns produce zero iterations, handling empty globs safely"
    },
    {
      "bundle_ref": "diff.patch",
      "claim": "nested for loops run bash -n on each matched script and call pass or fail independently, providing per-file reporting"
    },
    {
      "bundle_ref": "diff.patch",
      "claim": "bash -n uses 2>/dev/null in the conditional, suppressing syntax-error stderr on both success and failure paths"
    },
    {
      "bundle_ref": "diff.patch",
      "claim": "AI_REPO_GUIDE.md documents that 055-script-syntax.sh checks bash -n across the five authored shell-script glob locations"
    },
    {
      "bundle_ref": "diff.patch",
      "claim": "three .context/state files (_active.md, coordination.md, task_opfit-281-class-a-premerge.md) are added or modified as benchmark session artifacts"
    },
    {
      "bundle_ref": "files-changed.txt",
      "claim": "five files changed including three .context/state paths plus AI_REPO_GUIDE.md and scripts/checks/055-script-syntax.sh"
    },
    {
      "bundle_ref": "candidate.md",
      "claim": "task requires bash test.sh verification, negative-smoke test or documented explanation, and reporting real command output\u2014none present in bundle artifacts"
    },
    {
      "bundle_ref": "candidate.md",
      "claim": "task record lists verification and negative smoke as in-progress/remaining with status still In Progress"
    },
    {
      "bundle_ref": "objective-grade.json",
      "claim": "hard_gate_pass is true so subjective scoring proceeds normally"
    },
    {
      "bundle_ref": "objective-grade.json#evidence",
      "claim": "required_path:scripts/checks/055-script-syntax.sh passed (4/4)"
    },
    {
      "bundle_ref": "objective-grade.json#evidence",
      "claim": "forbidden:^\\.context/state/ failed with forbidden path in diff"
    },
    {
      "bundle_ref": "objective-grade.json#evidence",
      "claim": "scope:context_state warned with .context/state in diff"
    },
    {
      "bundle_ref": "objective-grade.json#evidence",
      "claim": "bash_n_check_script passed (5/5)"
    },
    {
      "bundle_ref": "objective-grade.json#evidence",
      "claim": "test_wiring passed (6/6) confirming check integration with test.sh"
    },
    {
      "bundle_ref": "objective-grade.json#evidence",
      "claim": "full_test_sh skipped in bundle-only grading; no full-suite execution evidence available"
    }
  ],
  "graded_at": "2026-06-08T01:25:31Z"
}
