{
  "schema_version": "benchmark-subjective-grade.v1",
  "score_set_id": "stage-1d-canonical-v1",
  "eval_candidate_id": "eval-005",
  "grader_id": "cursor-llm-blind-v1",
  "grader_prompt_id": "model-roi-grader-v1",
  "rubric_id": "rubric.v1",
  "categories": {
    "correctness": {
      "subjective_points": 9,
      "max_subjective_points": 10,
      "rationale": "The patch replaces the two hard-coded install.sh/test.sh checks with a nullglob-guarded loop over all five explicitly requested glob patterns (*.sh, scripts/*.sh, scripts/checks/*.sh, scripts/setup/*.sh, scripts/lib/*.sh). Each matched file is exercised independently via bash -n with pass()/fail() per file, satisfying per-file reporting and keeping the check parser-only. Minor deduction for suppressing bash -n stderr (2>/dev/null) and for lacking a [[ -f \"$f\" ]] guard against non-file paths; bundle provides no evidence that latent syntax errors elsewhere were discovered and fixed as required if expansion revealed them.",
      "uncertain": false
    },
    "quality": {
      "subjective_points": 12,
      "max_subjective_points": 15,
      "rationale": "Implementation is minimal, readable, and uses the explicit glob set matching the task contract with proper nullglob enable/disable. AI_REPO_GUIDE.md shellcheck path expansion aligns optional doc guidance with the widened script surface, which is appropriate doc-sync for a check expansion. Deductions for stderr suppression on failures (reduces debuggability), absence of inline comments documenting the nullglob rationale or excluded paths, and no defensive file-existence guard seen in stronger repo patterns.",
      "uncertain": false
    },
    "process": {
      "subjective_points": 4,
      "max_subjective_points": 5,
      "rationale": "Diff is tightly scoped to the required check script plus a companion AI_REPO_GUIDE.md update that mirrors the expanded glob set, consistent with doc-sync discipline and objective scope penalties fully satisfied (15/15 objective). One-point deduction because the bundle contains no verification notes, bash test.sh output, narrow syntax-check output, or documented negative-smoke demonstration/explanation required by acceptance criteria.",
      "uncertain": false
    },
    "reliability": {
      "subjective_points": 2,
      "max_subjective_points": 5,
      "rationale": "Objective evidence confirms test wiring (6/6) and bash_n_check_script pass, and the diff integrates with existing pass/fail helpers. Bundle lacks full_test_sh execution evidence (skipped in bundle-only grading), no reported command output, and no negative-smoke test or explanation that a deliberate syntax error is caught and cleared, leaving verification discipline thin despite plausible wiring.",
      "uncertain": true
    }
  },
  "subjective_total": 27,
  "uncertainty_notes": [
    "Bundle contains no bash test.sh run output, narrow syntax-check output, or negative-smoke demonstration/explanation required by acceptance criteria; reliability scored conservatively.",
    "Cannot confirm from bundle alone whether expanding coverage revealed latent syntax errors elsewhere requiring fixes in the same diff."
  ],
  "citations": [
    {
      "bundle_ref": "diff.patch",
      "claim": "for loop iterates *.sh, scripts/*.sh, scripts/checks/*.sh, scripts/setup/*.sh, and scripts/lib/*.sh covering all five requested glob locations"
    },
    {
      "bundle_ref": "diff.patch",
      "claim": "each matched file calls pass or fail after bash -n, providing independent per-file reporting"
    },
    {
      "bundle_ref": "diff.patch",
      "claim": "shopt -s nullglob before the loop and shopt -u nullglob after safely handles empty glob patterns"
    },
    {
      "bundle_ref": "diff.patch",
      "claim": "bash -n \"$f\" 2>/dev/null keeps the check parser-only but suppresses syntax-error stderr on failure"
    },
    {
      "bundle_ref": "diff.patch",
      "claim": "AI_REPO_GUIDE.md shellcheck example expanded to the same glob set as the syntax check"
    },
    {
      "bundle_ref": "files-changed.txt",
      "claim": "only AI_REPO_GUIDE.md and scripts/checks/055-script-syntax.sh changed, indicating focused scope"
    },
    {
      "bundle_ref": "candidate.md",
      "claim": "task requires bash test.sh verification, negative-smoke test or documented explanation, and reporting real command output\u2014none present in bundle artifacts"
    },
    {
      "bundle_ref": "objective-grade.json",
      "claim": "hard_gate_pass is true so subjective scoring proceeds normally"
    },
    {
      "bundle_ref": "objective-grade.json#evidence",
      "claim": "required_path:scripts/checks/055-script-syntax.sh passed (4/4)"
    },
    {
      "bundle_ref": "objective-grade.json#evidence",
      "claim": "bash_n_check_script passed (5/5)"
    },
    {
      "bundle_ref": "objective-grade.json#evidence",
      "claim": "test_wiring passed (6/6) confirming check integration with test.sh"
    },
    {
      "bundle_ref": "objective-grade.json#evidence",
      "claim": "full_test_sh skipped in bundle-only grading; no full-suite execution evidence available"
    }
  ],
  "graded_at": "2026-06-07T23:25:55Z"
}
