{
  "schema_version": "benchmark-subjective-grade.v1",
  "score_set_id": "stage-1e-canonical-v1-ctx-b-class-b-implementation",
  "eval_candidate_id": "eval-002",
  "grader_id": "stage-1e-locked-v1",
  "grader_prompt_id": "model-roi-grader-v1",
  "rubric_id": "rubric.v1",
  "categories": {
    "correctness": {
      "subjective_points": 2,
      "max_subjective_points": 10,
      "rationale": "root junk files called_once/counter"
    },
    "quality": {
      "subjective_points": 6,
      "max_subjective_points": 15,
      "rationale": "root junk files called_once/counter"
    },
    "process": {
      "subjective_points": 0,
      "max_subjective_points": 5,
      "rationale": "root junk files called_once/counter"
    },
    "reliability": {
      "subjective_points": 4,
      "max_subjective_points": 5,
      "rationale": "root junk files called_once/counter"
    }
  },
  "subjective_total": 12,
  "citations": [
    {
      "bundle_ref": "diff.patch",
      "claim": "root junk files called_once/counter"
    },
    {
      "bundle_ref": "objective-grade.json#evidence",
      "claim": "Objective checks applied before subjective residual mapping."
    }
  ],
  "graded_at": "2026-06-06T22:21:21Z"
}
