{
  "schema_version": "benchmark-subjective-grade.v1",
  "score_set_id": "stage-1e-canonical-v1-ctx-b-class-b-implementation",
  "eval_candidate_id": "eval-002",
  "grader_id": "cursor-llm-blind-v1",
  "grader_prompt_id": "model-roi-grader-v1",
  "rubric_id": "rubric.v1",
  "categories": {
    "correctness": {
      "subjective_points": 4,
      "max_subjective_points": 10,
      "rationale": "Core polling structure, allowlist loading, env defaults, and several exit paths (API_ERROR, SHA_CHANGED, QUIET_ELAPSED, TIMEOUT) are present, but CONVERGED semantics do not match the task contract. Reviews are fetched via GraphQL yet never used to identify participating allow-listed bots or verify terminal bot state; convergence is declared solely when unresolved bot-authored thread count is zero. A PR with zero unresolved bot threads but non-terminal participating bot reviews would incorrectly exit RESULT=CONVERGED. Participating-bot determination and review-state terminal checks required by the task are therefore missing. TIMEOUT emits RESULT=TIMEOUT without HEAD= even though a head SHA was available in-loop.",
      "uncertain": false
    },
    "quality": {
      "subjective_points": 6,
      "max_subjective_points": 15,
      "rationale": "The helper is readable with a documented exit contract, jq-based thread filtering, and sensible allowlist [bot] suffix handling. Docs and prompt were updated with helper preference and a documented fallback. However, fetched review nodes are dead weight, UNRESOLVED_COUNT via grep/wc on jq stream is fragile, and the prompt edit partially breaks prior blockquote structure. Out-of-scope repo-root artifacts counter (value 48) and called_once (test flag file) were committed, indicating incomplete cleanup and inconsistency with a focused deliverable.",
      "uncertain": false
    },
    "process": {
      "subjective_points": 2,
      "max_subjective_points": 5,
      "rationale": "Required companion surfaces (.github/prompts/pr-resolve-all.md, AI_REPO_GUIDE.md) were synced and the time-based fallback was preserved. Scope discipline is weak: counter and called_once are unrelated to the helper task and appear to be test or scratch artifacts left in the diff. Test wiring is only partial per objective evidence (1/2 patterns), and verification commands for bats/full test.sh were skipped rather than reported.",
      "uncertain": false
    },
    "reliability": {
      "subjective_points": 1,
      "max_subjective_points": 5,
      "rationale": "Bats coverage exists for missing-arg, API_ERROR, TIMEOUT, and SHA_CHANGED paths, and bash -n/lint passed objectively, but the two primary success paths (CONVERGED, QUIET_ELAPSED) are untested. Objective grading skipped bats execution. The committed called_once file likely breaks the SHA_CHANGED test (mock returns sha2 immediately when the file already exists), so the one mid-loop SHA test may not exercise the intended behavior. No credible verification artifact demonstrates end-to-end contract compliance.",
      "uncertain": true
    }
  },
  "subjective_total": 13,
  "uncertainty_notes": [
    "Bats tests were not executed in objective grading; committed called_once may invalidate the SHA_CHANGED test logic.",
    "Live GitHub polling behavior cannot be verified from the bundle diff alone."
  ],
  "citations": [
    {
      "bundle_ref": "diff.patch",
      "claim": "GraphQL query fetches reviews with author/state/updatedAt but convergence logic only inspects reviewThreads for unresolved allow-listed bot comments."
    },
    {
      "bundle_ref": "diff.patch",
      "claim": "CONVERGED exits when UNRESOLVED_COUNT is 0 without checking participating bot review terminal state."
    },
    {
      "bundle_ref": "candidate.md",
      "claim": "Task requires CONVERGED when participating expected bots are terminal for the current head and no unresolved actionable bot-authored review threads remain."
    },
    {
      "bundle_ref": "diff.patch",
      "claim": "TIMEOUT path prints RESULT=TIMEOUT and exits 2 without emitting HEAD=<sha>."
    },
    {
      "bundle_ref": "diff.patch",
      "claim": "New repo-root files counter (48) and called_once are outside the requested helper, allowlist, tests, and doc surfaces."
    },
    {
      "bundle_ref": "diff.patch",
      "claim": "SHA_CHANGED bats mock uses repo-root called_once flag file, which is also committed as an empty artifact in the same diff."
    },
    {
      "bundle_ref": "diff.patch",
      "claim": "Prompt update adds settle-window helper preference and documents API_ERROR fallback to manual sleep."
    },
    {
      "bundle_ref": "objective-grade.json#evidence",
      "claim": "bats_poll_helper and full_test_sh checks were skipped; test_wiring matched only 1/2 patterns."
    },
    {
      "bundle_ref": "files-changed.txt",
      "claim": "counter appears in changed files list as out-of-scope churn beyond helper/docs/tests."
    },
    {
      "bundle_ref": "diff.patch",
      "claim": "Bats file covers API_ERROR, TIMEOUT, and SHA_CHANGED but has no CONVERGED or QUIET_ELAPSED cases."
    }
  ],
  "graded_at": "2026-06-08T02:30:22Z"
}
